{
  "apiVersion": 1,
  "packageId": "district96.lunch-menu",
  "packageVersion": "1.0.0",
  "name": "Lunch Menu",
  "description": "Today's school lunch menu.",
  "publisher": { "id": "district96", "name": "District 96" },
  "repository": "https://github.com/district96/tilecast-lunch",
  "license": "Apache-2.0",
  "tilecast": { "version": ">=1.1" },
  "distribution": { "oci": "ghcr.io/district96/tilecast-lunch" },
  "contributions": [{ "type": "dataSource", "path": "./data-sources/menu" }]
}
